{
  "schema_version": 1,
  "id": "url-purrfect-logic-4-max-mini",
  "type": "url",
  "url": "https://old.reddit.com/r/SillyTavernAI/comments/1twlef0/purrfect_logic_4_max_mini_update_token_cleanup/",
  "published_at": null,
  "version": "4 Max Mini",
  "artifact_size_bytes": null,
  "license_status": "missing",
  "license_spdx_id": null,
  "status": "active",
  "status_reason": null,
  "refresh_policy": "paused"
}
